{"$defs":{"hash":{"pattern":"^[0-9a-f]{64}$","type":"string"},"nat":{"pattern":"^(0|[1-9][0-9]*)$","type":"string"}},"$id":"https://example.invalid/collatz/computation-attempt-v1.schema.json","$schema":"https://json-schema.org/draft/2020-12/schema","additionalProperties":false,"properties":{"accepted":{"const":true},"binary_sha256":{"$ref":"#/$defs/hash"},"command":{"items":{"type":"string"},"minItems":1,"type":"array"},"elapsed_milliseconds":{"$ref":"#/$defs/nat"},"engine":{"enum":["cpp-gmp-prover","independent-rust-verifier"]},"exit_code":{"const":0},"hostname":{"minLength":1,"type":"string"},"m":{"enum":["92","93","94","95","96"]},"machine":{"minLength":1,"type":"string"},"platform":{"minLength":1,"type":"string"},"result_id":{"$ref":"#/$defs/hash"},"schema":{"const":"collatz.computation-attempt.v1"},"started_epoch":{"$ref":"#/$defs/nat"},"timed_out":{"const":false},"unit_id":{"$ref":"#/$defs/hash"}},"required":["accepted","binary_sha256","command","elapsed_milliseconds","engine","exit_code","hostname","m","machine","platform","result_id","schema","started_epoch","timed_out","unit_id"],"title":"Accepted exhaustive-engine computation attempt","type":"object"}
