{"accepted":true,"binary_sha256":"39c4568d84879e14e9d6dfbb7dad90e4f814e0f663eb294ed63aa6744aa09594","command":["/workspace/release/bin/collatz_verify_unit","--config","/workspace/certificates/config/case_m96.json","--unit","/workspace/dist/search-v2/plan/m96/k1_14/units/891efd43b850abdeab0594c06c8f2d90949f8f7b8ca3162c417a49c6a0f91545.json","--output","/workspace/dist/search-v2/results/verifier/.partial/891efd43b850abdeab0594c06c8f2d90949f8f7b8ca3162c417a49c6a0f91545.json","--math-certificate","/workspace/certificates/analytic/m92_96_reductions.json","--enum-threshold","256"],"elapsed_milliseconds":"126309549","engine":"independent-rust-verifier","exit_code":0,"hostname":"8b7f5a2919f8","m":"96","machine":"x86_64","platform":"Linux-6.17.0-1019-aws-x86_64-with-glibc2.36","result_id":"cb34a48ff9e3a67edc0e24d0aee1cbb404e1ca87ba56a241aee21ec18ca90d2d","schema":"collatz.computation-attempt.v1","started_epoch":"1785081929","timed_out":false,"unit_id":"891efd43b850abdeab0594c06c8f2d90949f8f7b8ca3162c417a49c6a0f91545"}
