{"accepted":true,"binary_sha256":"39c4568d84879e14e9d6dfbb7dad90e4f814e0f663eb294ed63aa6744aa09594","command":["/workspace/release/bin/collatz_verify_unit","--config","/workspace/certificates/config/case_m96.json","--unit","/workspace/dist/search-v2/plan/m96/k1_06/units/83b3540bcdde102e3b39d4dfc6e3839dc05f96f4eeba591e1cae6214e0922f38.json","--output","/workspace/dist/search-v2/results/verifier/.partial/83b3540bcdde102e3b39d4dfc6e3839dc05f96f4eeba591e1cae6214e0922f38.json","--math-certificate","/workspace/certificates/analytic/m92_96_reductions.json","--enum-threshold","256"],"elapsed_milliseconds":"130680135","engine":"independent-rust-verifier","exit_code":0,"hostname":"ae33a904033b","m":"96","machine":"x86_64","platform":"Linux-6.17.0-1019-aws-x86_64-with-glibc2.36","result_id":"22f8dcd68447e76cc46ea94da135d6a9ee54c14faa5753a8e90dc7cf44bb8c6e","schema":"collatz.computation-attempt.v1","started_epoch":"1785251136","timed_out":false,"unit_id":"83b3540bcdde102e3b39d4dfc6e3839dc05f96f4eeba591e1cae6214e0922f38"}
