{"accepted":true,"binary_sha256":"39c4568d84879e14e9d6dfbb7dad90e4f814e0f663eb294ed63aa6744aa09594","command":["/workspace/release/bin/collatz_verify_unit","--config","/workspace/certificates/config/case_m93.json","--unit","/workspace/dist/search-v2/plan/m93/k1_43/units/527b05acd0f2c3f8cab78ff499f3ae4e6d34f0536a5aa65d81971f8be00f11b7.json","--output","/workspace/dist/search-v2/results/verifier/.partial/527b05acd0f2c3f8cab78ff499f3ae4e6d34f0536a5aa65d81971f8be00f11b7.json","--math-certificate","/workspace/certificates/analytic/m92_96_reductions.json","--enum-threshold","256"],"elapsed_milliseconds":"314","engine":"independent-rust-verifier","exit_code":0,"hostname":"8b7f5a2919f8","m":"93","machine":"x86_64","platform":"Linux-6.17.0-1019-aws-x86_64-with-glibc2.36","result_id":"de50d493ab7709279aa7001d52cd2f8e5a69ade7865c4164b51e36e7d340ac82","schema":"collatz.computation-attempt.v1","started_epoch":"1785073752","timed_out":false,"unit_id":"527b05acd0f2c3f8cab78ff499f3ae4e6d34f0536a5aa65d81971f8be00f11b7"}
