{"accepted":true,"binary_sha256":"39c4568d84879e14e9d6dfbb7dad90e4f814e0f663eb294ed63aa6744aa09594","command":["/workspace/release/bin/collatz_verify_unit","--config","/workspace/certificates/config/case_m92.json","--unit","/workspace/dist/search-v2/plan/m92/k1_46/units/4b995c81a46d1844c2f64ebe1a21bbb5a258662662157dca983ad9c3e44d0ed9.json","--output","/workspace/dist/search-v2/results/verifier/.partial/4b995c81a46d1844c2f64ebe1a21bbb5a258662662157dca983ad9c3e44d0ed9.json","--math-certificate","/workspace/certificates/analytic/m92_96_reductions.json","--enum-threshold","256"],"elapsed_milliseconds":"110","engine":"independent-rust-verifier","exit_code":0,"hostname":"8b7f5a2919f8","m":"92","machine":"x86_64","platform":"Linux-6.17.0-1019-aws-x86_64-with-glibc2.36","result_id":"152bdeccc0cbc9e1ad3a8aebfb496f605217c9d2de14c0cad68c3fcaa23be14f","schema":"collatz.computation-attempt.v1","started_epoch":"1785073751","timed_out":false,"unit_id":"4b995c81a46d1844c2f64ebe1a21bbb5a258662662157dca983ad9c3e44d0ed9"}
