{"accepted":true,"binary_sha256":"10ffa2fba9669a2c205268867e19f855c64335d522ab07e6d496283105fa7733","command":["/workspace/release/bin/collatz_prover","search-unit","--config","/workspace/certificates/config/case_m96.json","--unit","/workspace/dist/search-v2/plan/m96/k1_04/units/4facf677d9606b2b2402bfeb25ea67afde68239d3d04f6e5a15058390f2b2b32.json","--output","/workspace/dist/search-v2/results/prover/.partial/4facf677d9606b2b2402bfeb25ea67afde68239d3d04f6e5a15058390f2b2b32.json","--math-certificate","/workspace/certificates/analytic/m92_96_reductions.json","--enum-threshold","256"],"elapsed_milliseconds":"66209106","engine":"cpp-gmp-prover","exit_code":0,"hostname":"a8989f985811","m":"96","machine":"x86_64","platform":"Linux-6.17.0-1019-aws-x86_64-with-glibc2.36","result_id":"9b513924ebf56bb1cc5153145da79441ab62c59b0fb5919a4cd0a1ccd096e197","schema":"collatz.computation-attempt.v1","started_epoch":"1784780525","timed_out":false,"unit_id":"4facf677d9606b2b2402bfeb25ea67afde68239d3d04f6e5a15058390f2b2b32"}
