{"accepted":true,"binary_sha256":"39c4568d84879e14e9d6dfbb7dad90e4f814e0f663eb294ed63aa6744aa09594","command":["/workspace/release/bin/collatz_verify_unit","--config","/workspace/certificates/config/case_m96.json","--unit","/workspace/dist/search-v2/plan/m96/k1_52/units/d43390a447d965e305daccc2ab1d73241a8ed96562af54507d21f413f6946102.json","--output","/workspace/dist/search-v2/results/verifier/.partial/d43390a447d965e305daccc2ab1d73241a8ed96562af54507d21f413f6946102.json","--math-certificate","/workspace/certificates/analytic/m92_96_reductions.json","--enum-threshold","256"],"elapsed_milliseconds":"5163","engine":"independent-rust-verifier","exit_code":0,"hostname":"ae33a904033b","m":"96","machine":"x86_64","platform":"Linux-6.17.0-1019-aws-x86_64-with-glibc2.36","result_id":"9798ced77fae45bbae4905dddd5896cee67cce461a89ffacd66b8d1d21868d71","schema":"collatz.computation-attempt.v1","started_epoch":"1785470644","timed_out":false,"unit_id":"d43390a447d965e305daccc2ab1d73241a8ed96562af54507d21f413f6946102"}
