{"accepted":true,"binary_sha256":"39c4568d84879e14e9d6dfbb7dad90e4f814e0f663eb294ed63aa6744aa09594","command":["/workspace/release/bin/collatz_verify_unit","--config","/workspace/certificates/config/case_m96.json","--unit","/workspace/dist/search-v2/plan/m96/k1_03/units/5f4d642936312572784830cc5a0eab1c59c542c1944296a9ee65697040a9d8a3.json","--output","/workspace/dist/search-v2/results/verifier/.partial/5f4d642936312572784830cc5a0eab1c59c542c1944296a9ee65697040a9d8a3.json","--math-certificate","/workspace/certificates/analytic/m92_96_reductions.json","--enum-threshold","256"],"elapsed_milliseconds":"62558614","engine":"independent-rust-verifier","exit_code":0,"hostname":"8b7f5a2919f8","m":"96","machine":"x86_64","platform":"Linux-6.17.0-1019-aws-x86_64-with-glibc2.36","result_id":"4e5865bee862fec65cffbecd4c2a73a95d71b4e4eba01ef96199c55d10139248","schema":"collatz.computation-attempt.v1","started_epoch":"1785080777","timed_out":false,"unit_id":"5f4d642936312572784830cc5a0eab1c59c542c1944296a9ee65697040a9d8a3"}
