{"accepted":true,"binary_sha256":"10ffa2fba9669a2c205268867e19f855c64335d522ab07e6d496283105fa7733","command":["/workspace/release/bin/collatz_prover","search-unit","--config","/workspace/certificates/config/case_m95.json","--unit","/workspace/dist/search-v2/plan/m95/k1_04/units/f3da7e931e4495a01dde7cc05d3b2b7cc551ac80465730b3dd2d60184fdc3f4c.json","--output","/workspace/dist/search-v2/results/prover/.partial/f3da7e931e4495a01dde7cc05d3b2b7cc551ac80465730b3dd2d60184fdc3f4c.json","--math-certificate","/workspace/certificates/analytic/m92_96_reductions.json","--enum-threshold","256"],"elapsed_milliseconds":"1479003","engine":"cpp-gmp-prover","exit_code":0,"hostname":"5d2a0edd4530","m":"95","machine":"x86_64","platform":"Linux-6.17.0-1019-aws-x86_64-with-glibc2.36","result_id":"28fe3a72a25e456b8616fc4ea52aa2181c1a18152f3cce1a30cb14388c908099","schema":"collatz.computation-attempt.v1","started_epoch":"1784535806","timed_out":false,"unit_id":"f3da7e931e4495a01dde7cc05d3b2b7cc551ac80465730b3dd2d60184fdc3f4c"}
