{"accepted":true,"binary_sha256":"10ffa2fba9669a2c205268867e19f855c64335d522ab07e6d496283105fa7733","command":["/workspace/release/bin/collatz_prover","search-unit","--config","/workspace/certificates/config/case_m96.json","--unit","/workspace/dist/search-v2/plan/m96/k1_40/units/87173809792cec577c885e0e7c1ce75dc06ac3b553dbab236a6021a5bf175919.json","--output","/workspace/dist/search-v2/results/prover/.partial/87173809792cec577c885e0e7c1ce75dc06ac3b553dbab236a6021a5bf175919.json","--math-certificate","/workspace/certificates/analytic/m92_96_reductions.json","--enum-threshold","256"],"elapsed_milliseconds":"666468","engine":"cpp-gmp-prover","exit_code":0,"hostname":"a8989f985811","m":"96","machine":"x86_64","platform":"Linux-6.17.0-1019-aws-x86_64-with-glibc2.36","result_id":"07bec03871cb37f645cc19066780facea06843e70c4c33ea12f5a5f4afb50ec9","schema":"collatz.computation-attempt.v1","started_epoch":"1784879965","timed_out":false,"unit_id":"87173809792cec577c885e0e7c1ce75dc06ac3b553dbab236a6021a5bf175919"}
