{"accepted":true,"binary_sha256":"39c4568d84879e14e9d6dfbb7dad90e4f814e0f663eb294ed63aa6744aa09594","command":["/workspace/release/bin/collatz_verify_unit","--config","/workspace/certificates/config/case_m94.json","--unit","/workspace/dist/search-v2/plan/m94/k1_53/units/68c13d7d8d4ee559bd5ea60908393d011a27709ef93681e5f04f15f06d03e8b1.json","--output","/workspace/dist/search-v2/results/verifier/.partial/68c13d7d8d4ee559bd5ea60908393d011a27709ef93681e5f04f15f06d03e8b1.json","--math-certificate","/workspace/certificates/analytic/m92_96_reductions.json","--enum-threshold","256"],"elapsed_milliseconds":"479","engine":"independent-rust-verifier","exit_code":0,"hostname":"8b7f5a2919f8","m":"94","machine":"x86_64","platform":"Linux-6.17.0-1019-aws-x86_64-with-glibc2.36","result_id":"9e3af9bcf659688995cadb938776b08d60d6823b3c666fb46efc813ae8681d5f","schema":"collatz.computation-attempt.v1","started_epoch":"1785073812","timed_out":false,"unit_id":"68c13d7d8d4ee559bd5ea60908393d011a27709ef93681e5f04f15f06d03e8b1"}
