{"accepted":true,"binary_sha256":"10ffa2fba9669a2c205268867e19f855c64335d522ab07e6d496283105fa7733","command":["/home/sina/Documents/github/MaskoMys/Collatz-m96-Certificates-Pipeline/release/bin/collatz_prover","search-unit","--config","/home/sina/Documents/github/MaskoMys/Collatz-m96-Certificates-Pipeline/certificates/config/case_m92.json","--unit","/home/sina/Documents/github/MaskoMys/Collatz-m96-Certificates-Pipeline/dist/search-v2/plan/m92/k1_26/units/66e7a612cb51313a02f9d4bf15a5192179642ac970a820fd5a3f9244ab20b649.json","--output","/home/sina/Documents/github/MaskoMys/Collatz-m96-Certificates-Pipeline/dist/search-v2/results/prover/.partial/66e7a612cb51313a02f9d4bf15a5192179642ac970a820fd5a3f9244ab20b649.json","--math-certificate","/home/sina/Documents/github/MaskoMys/Collatz-m96-Certificates-Pipeline/certificates/analytic/m92_96_reductions.json","--enum-threshold","256"],"elapsed_milliseconds":"23","engine":"cpp-gmp-prover","exit_code":0,"hostname":"sinruda","m":"92","machine":"x86_64","platform":"Linux-7.1.4-zen1-1-zen-x86_64-with-glibc2.43","result_id":"9e05331aed0f9d9b6273d56b129bba1cffe978fe9fe44bf178fc7c12ddf076db","schema":"collatz.computation-attempt.v1","started_epoch":"1785073140","timed_out":false,"unit_id":"66e7a612cb51313a02f9d4bf15a5192179642ac970a820fd5a3f9244ab20b649"}
