{"accepted":true,"binary_sha256":"10ffa2fba9669a2c205268867e19f855c64335d522ab07e6d496283105fa7733","command":["/workspace/release/bin/collatz_prover","search-unit","--config","/workspace/certificates/config/case_m95.json","--unit","/workspace/dist/search-v2/plan/m95/k1_20/units/51129d8fd76b0868f68cd9db77f79a992cbdf531f70d0faa206dabec34c2e1d2.json","--output","/workspace/dist/search-v2/results/prover/.partial/51129d8fd76b0868f68cd9db77f79a992cbdf531f70d0faa206dabec34c2e1d2.json","--math-certificate","/workspace/certificates/analytic/m92_96_reductions.json","--enum-threshold","256"],"elapsed_milliseconds":"1359068","engine":"cpp-gmp-prover","exit_code":0,"hostname":"5d2a0edd4530","m":"95","machine":"x86_64","platform":"Linux-6.17.0-1019-aws-x86_64-with-glibc2.36","result_id":"808d11c42e4b13c07f02e5586ccfc699aec1aab869c5f9d83348434d4b82914c","schema":"collatz.computation-attempt.v1","started_epoch":"1784539287","timed_out":false,"unit_id":"51129d8fd76b0868f68cd9db77f79a992cbdf531f70d0faa206dabec34c2e1d2"}
