{"accepted":true,"binary_sha256":"39c4568d84879e14e9d6dfbb7dad90e4f814e0f663eb294ed63aa6744aa09594","command":["/workspace/release/bin/collatz_verify_unit","--config","/workspace/certificates/config/case_m94.json","--unit","/workspace/dist/search-v2/plan/m94/k1_60/units/3aff80978cdf5a3c1862cb84c3d507261db878889aa54dc59eb858f9df25d399.json","--output","/workspace/dist/search-v2/results/verifier/.partial/3aff80978cdf5a3c1862cb84c3d507261db878889aa54dc59eb858f9df25d399.json","--math-certificate","/workspace/certificates/analytic/m92_96_reductions.json","--enum-threshold","256"],"elapsed_milliseconds":"97","engine":"independent-rust-verifier","exit_code":0,"hostname":"8b7f5a2919f8","m":"94","machine":"x86_64","platform":"Linux-6.17.0-1019-aws-x86_64-with-glibc2.36","result_id":"9cf427a91422cc55ecf19a2ce3f972c1088bf6bcb83bd28044f66523354c0ab2","schema":"collatz.computation-attempt.v1","started_epoch":"1785073813","timed_out":false,"unit_id":"3aff80978cdf5a3c1862cb84c3d507261db878889aa54dc59eb858f9df25d399"}
