{"accepted":true,"binary_sha256":"10ffa2fba9669a2c205268867e19f855c64335d522ab07e6d496283105fa7733","command":["/workspace/release/bin/collatz_prover","search-unit","--config","/workspace/certificates/config/case_m95.json","--unit","/workspace/dist/search-v2/plan/m95/k1_12/units/4bc61e7952646b40683650c58bfaefa12c0915a5e408030cb13c0f7f72044b09.json","--output","/workspace/dist/search-v2/results/prover/.partial/4bc61e7952646b40683650c58bfaefa12c0915a5e408030cb13c0f7f72044b09.json","--math-certificate","/workspace/certificates/analytic/m92_96_reductions.json","--enum-threshold","256"],"elapsed_milliseconds":"1932131","engine":"cpp-gmp-prover","exit_code":0,"hostname":"5d2a0edd4530","m":"95","machine":"x86_64","platform":"Linux-6.17.0-1019-aws-x86_64-with-glibc2.36","result_id":"366a9bc5bf60451a216658fd0df229f8dab0f4e11ddeb936dd4e9333e24723d8","schema":"collatz.computation-attempt.v1","started_epoch":"1784536689","timed_out":false,"unit_id":"4bc61e7952646b40683650c58bfaefa12c0915a5e408030cb13c0f7f72044b09"}
