{"accepted":true,"binary_sha256":"39c4568d84879e14e9d6dfbb7dad90e4f814e0f663eb294ed63aa6744aa09594","command":["/workspace/release/bin/collatz_verify_unit","--config","/workspace/certificates/config/case_m93.json","--unit","/workspace/dist/search-v2/plan/m93/k1_63/units/da7c56608225b60d0a945d3d0892e9c63f4a635539914e9f8cd9785dff5717c9.json","--output","/workspace/dist/search-v2/results/verifier/.partial/da7c56608225b60d0a945d3d0892e9c63f4a635539914e9f8cd9785dff5717c9.json","--math-certificate","/workspace/certificates/analytic/m92_96_reductions.json","--enum-threshold","256"],"elapsed_milliseconds":"101","engine":"independent-rust-verifier","exit_code":0,"hostname":"8b7f5a2919f8","m":"93","machine":"x86_64","platform":"Linux-6.17.0-1019-aws-x86_64-with-glibc2.36","result_id":"83b3e629fdb9c12082ee10017361e2e152663814f5ed6894794f167da97bc94b","schema":"collatz.computation-attempt.v1","started_epoch":"1785073753","timed_out":false,"unit_id":"da7c56608225b60d0a945d3d0892e9c63f4a635539914e9f8cd9785dff5717c9"}
