{"accepted":true,"binary_sha256":"10ffa2fba9669a2c205268867e19f855c64335d522ab07e6d496283105fa7733","command":["/workspace/release/bin/collatz_prover","search-unit","--config","/workspace/certificates/config/case_m95.json","--unit","/workspace/dist/search-v2/plan/m95/k1_07/units/bc99d7e755ebf7c96b5cfc1c555fed8d64ca5e6fff9bcc05f1eff97885a1df0a.json","--output","/workspace/dist/search-v2/results/prover/.partial/bc99d7e755ebf7c96b5cfc1c555fed8d64ca5e6fff9bcc05f1eff97885a1df0a.json","--math-certificate","/workspace/certificates/analytic/m92_96_reductions.json","--enum-threshold","256"],"elapsed_milliseconds":"1782246","engine":"cpp-gmp-prover","exit_code":0,"hostname":"5d2a0edd4530","m":"95","machine":"x86_64","platform":"Linux-6.17.0-1019-aws-x86_64-with-glibc2.36","result_id":"fe73fdb10d98f73898bddca373ba03ae9296f0ac14b7a812de67883f05d58715","schema":"collatz.computation-attempt.v1","started_epoch":"1784535806","timed_out":false,"unit_id":"bc99d7e755ebf7c96b5cfc1c555fed8d64ca5e6fff9bcc05f1eff97885a1df0a"}
