{"accepted":true,"binary_sha256":"39c4568d84879e14e9d6dfbb7dad90e4f814e0f663eb294ed63aa6744aa09594","command":["/workspace/release/bin/collatz_verify_unit","--config","/workspace/certificates/config/case_m93.json","--unit","/workspace/dist/search-v2/plan/m93/k1_52/units/5f45a78f6e692c4779216ff03fbdede46953b21a38ce827692258eac76e5195f.json","--output","/workspace/dist/search-v2/results/verifier/.partial/5f45a78f6e692c4779216ff03fbdede46953b21a38ce827692258eac76e5195f.json","--math-certificate","/workspace/certificates/analytic/m92_96_reductions.json","--enum-threshold","256"],"elapsed_milliseconds":"118","engine":"independent-rust-verifier","exit_code":0,"hostname":"8b7f5a2919f8","m":"93","machine":"x86_64","platform":"Linux-6.17.0-1019-aws-x86_64-with-glibc2.36","result_id":"e65d3165564716aef8c0b6783f92c2953db3975a94dd13cace7645805d0b366f","schema":"collatz.computation-attempt.v1","started_epoch":"1785073752","timed_out":false,"unit_id":"5f45a78f6e692c4779216ff03fbdede46953b21a38ce827692258eac76e5195f"}
