{"accepted":true,"binary_sha256":"10ffa2fba9669a2c205268867e19f855c64335d522ab07e6d496283105fa7733","command":["/workspace/release/bin/collatz_prover","search-unit","--config","/workspace/certificates/config/case_m95.json","--unit","/workspace/dist/search-v2/plan/m95/k1_15/units/9f06f00f8d0e4b2d9c1f4df362c599bc690d76763ca9d4064ba4d664526eed3a.json","--output","/workspace/dist/search-v2/results/prover/.partial/9f06f00f8d0e4b2d9c1f4df362c599bc690d76763ca9d4064ba4d664526eed3a.json","--math-certificate","/workspace/certificates/analytic/m92_96_reductions.json","--enum-threshold","256"],"elapsed_milliseconds":"1682194","engine":"cpp-gmp-prover","exit_code":0,"hostname":"5d2a0edd4530","m":"95","machine":"x86_64","platform":"Linux-6.17.0-1019-aws-x86_64-with-glibc2.36","result_id":"461ade9c5dabc5c200d8ced20c12300364c26cf03caca73fbec301a11d779a5e","schema":"collatz.computation-attempt.v1","started_epoch":"1784537653","timed_out":false,"unit_id":"9f06f00f8d0e4b2d9c1f4df362c599bc690d76763ca9d4064ba4d664526eed3a"}
