{"accepted":true,"binary_sha256":"39c4568d84879e14e9d6dfbb7dad90e4f814e0f663eb294ed63aa6744aa09594","command":["/workspace/release/bin/collatz_verify_unit","--config","/workspace/certificates/config/case_m96.json","--unit","/workspace/dist/search-v2/plan/m96/k1_04/units/4facf677d9606b2b2402bfeb25ea67afde68239d3d04f6e5a15058390f2b2b32.json","--output","/workspace/dist/search-v2/results/verifier/.partial/4facf677d9606b2b2402bfeb25ea67afde68239d3d04f6e5a15058390f2b2b32.json","--math-certificate","/workspace/certificates/analytic/m92_96_reductions.json","--enum-threshold","256"],"elapsed_milliseconds":"113532841","engine":"independent-rust-verifier","exit_code":0,"hostname":"8b7f5a2919f8","m":"96","machine":"x86_64","platform":"Linux-6.17.0-1019-aws-x86_64-with-glibc2.36","result_id":"8c97eddeca7029a98129d331d8b3643a37485500908cb40b6d3c36bb89e43f66","schema":"collatz.computation-attempt.v1","started_epoch":"1785080837","timed_out":false,"unit_id":"4facf677d9606b2b2402bfeb25ea67afde68239d3d04f6e5a15058390f2b2b32"}
