{"accepted":true,"binary_sha256":"39c4568d84879e14e9d6dfbb7dad90e4f814e0f663eb294ed63aa6744aa09594","command":["/workspace/release/bin/collatz_verify_unit","--config","/workspace/certificates/config/case_m95.json","--unit","/workspace/dist/search-v2/plan/m95/k1_11/units/ebcd7de25bc7435e5bf2a4f7e02a83b74b3c393afaeda8db404db94da74de1a4.json","--output","/workspace/dist/search-v2/results/verifier/.partial/ebcd7de25bc7435e5bf2a4f7e02a83b74b3c393afaeda8db404db94da74de1a4.json","--math-certificate","/workspace/certificates/analytic/m92_96_reductions.json","--enum-threshold","256"],"elapsed_milliseconds":"3101914","engine":"independent-rust-verifier","exit_code":0,"hostname":"8b7f5a2919f8","m":"95","machine":"x86_64","platform":"Linux-6.17.0-1019-aws-x86_64-with-glibc2.36","result_id":"da9b9036c4a741183c118717c4a9b557ca45bce8b6b071c27abe6b57ee5826c5","schema":"collatz.computation-attempt.v1","started_epoch":"1785073827","timed_out":false,"unit_id":"ebcd7de25bc7435e5bf2a4f7e02a83b74b3c393afaeda8db404db94da74de1a4"}
