{"accepted":true,"binary_sha256":"10ffa2fba9669a2c205268867e19f855c64335d522ab07e6d496283105fa7733","command":["/workspace/release/bin/collatz_prover","search-unit","--config","/workspace/certificates/config/case_m95.json","--unit","/workspace/dist/search-v2/plan/m95/k1_48/units/444ca3f1670f710b7240857c54af7b2309499041ff350271883ce173303e24ae.json","--output","/workspace/dist/search-v2/results/prover/.partial/444ca3f1670f710b7240857c54af7b2309499041ff350271883ce173303e24ae.json","--math-certificate","/workspace/certificates/analytic/m92_96_reductions.json","--enum-threshold","256"],"elapsed_milliseconds":"7081","engine":"cpp-gmp-prover","exit_code":0,"hostname":"5d2a0edd4530","m":"95","machine":"x86_64","platform":"Linux-6.17.0-1019-aws-x86_64-with-glibc2.36","result_id":"5a6bc63d82ecd6adfdebd5073e511a362dc018c355048e679edd93f55065d3e0","schema":"collatz.computation-attempt.v1","started_epoch":"1784540046","timed_out":false,"unit_id":"444ca3f1670f710b7240857c54af7b2309499041ff350271883ce173303e24ae"}
