{"accepted":true,"binary_sha256":"39c4568d84879e14e9d6dfbb7dad90e4f814e0f663eb294ed63aa6744aa09594","command":["/workspace/release/bin/collatz_verify_unit","--config","/workspace/certificates/config/case_m96.json","--unit","/workspace/dist/search-v2/plan/m96/k1_33/units/3ca719534e55914f009b75d7c4a653550530fdbe4d32d6c6839a7907df3412a4.json","--output","/workspace/dist/search-v2/results/verifier/.partial/3ca719534e55914f009b75d7c4a653550530fdbe4d32d6c6839a7907df3412a4.json","--math-certificate","/workspace/certificates/analytic/m92_96_reductions.json","--enum-threshold","256"],"elapsed_milliseconds":"6473786","engine":"independent-rust-verifier","exit_code":0,"hostname":"ae33a904033b","m":"96","machine":"x86_64","platform":"Linux-6.17.0-1019-aws-x86_64-with-glibc2.36","result_id":"2ae92f270e197c04b003d338a64be7cdee5f797d1b25cbaab66e2e6d79f53217","schema":"collatz.computation-attempt.v1","started_epoch":"1785465051","timed_out":false,"unit_id":"3ca719534e55914f009b75d7c4a653550530fdbe4d32d6c6839a7907df3412a4"}
