{"accepted":true,"binary_sha256":"39c4568d84879e14e9d6dfbb7dad90e4f814e0f663eb294ed63aa6744aa09594","command":["/workspace/release/bin/collatz_verify_unit","--config","/workspace/certificates/config/case_m95.json","--unit","/workspace/dist/search-v2/plan/m95/k1_40/units/6e9a8299fddef2aab4c577edcd8139ea31c865d74c8b30622349a5d4cc00c1d8.json","--output","/workspace/dist/search-v2/results/verifier/.partial/6e9a8299fddef2aab4c577edcd8139ea31c865d74c8b30622349a5d4cc00c1d8.json","--math-certificate","/workspace/certificates/analytic/m92_96_reductions.json","--enum-threshold","256"],"elapsed_milliseconds":"147731","engine":"independent-rust-verifier","exit_code":0,"hostname":"8b7f5a2919f8","m":"95","machine":"x86_64","platform":"Linux-6.17.0-1019-aws-x86_64-with-glibc2.36","result_id":"79631eda45adb373197e12ec585facdf0cd9cfcf63fd4e6e6df1200dd0cdbfb1","schema":"collatz.computation-attempt.v1","started_epoch":"1785080588","timed_out":false,"unit_id":"6e9a8299fddef2aab4c577edcd8139ea31c865d74c8b30622349a5d4cc00c1d8"}
