{"accepted":true,"binary_sha256":"39c4568d84879e14e9d6dfbb7dad90e4f814e0f663eb294ed63aa6744aa09594","command":["/workspace/release/bin/collatz_verify_unit","--config","/workspace/certificates/config/case_m93.json","--unit","/workspace/dist/search-v2/plan/m93/k1_09/units/54316ac2db71584d04e086087e8692bb7a7a98c88220279e24fafb27eb6b77f3.json","--output","/workspace/dist/search-v2/results/verifier/.partial/54316ac2db71584d04e086087e8692bb7a7a98c88220279e24fafb27eb6b77f3.json","--math-certificate","/workspace/certificates/analytic/m92_96_reductions.json","--enum-threshold","256"],"elapsed_milliseconds":"542","engine":"independent-rust-verifier","exit_code":0,"hostname":"8b7f5a2919f8","m":"93","machine":"x86_64","platform":"Linux-6.17.0-1019-aws-x86_64-with-glibc2.36","result_id":"6a63f2327bdc53317c9e7996273df647a288fe3aae43d9f14375656931d20282","schema":"collatz.computation-attempt.v1","started_epoch":"1785073752","timed_out":false,"unit_id":"54316ac2db71584d04e086087e8692bb7a7a98c88220279e24fafb27eb6b77f3"}
